{
  "schemaVersion": "1.1",
  "researchReleaseId": "11111111-1111-4111-8111-111111111111",
  "textContext": {
    "corpusReleaseId": "22222222-2222-4222-8222-222222222222",
    "digitalExpressionId": "33333333-3333-4333-8333-333333333333",
    "textStreamId": "44444444-4444-4444-8444-444444444444",
    "normalizationProfileId": "55555555-5555-4555-8555-555555555555"
  },
  "analysisContext": {
    "layers": [
      {
        "layerKind": "MORPHEME_SEGMENTATION",
        "annotationLayerId": "66666666-6666-4666-8666-666666666666"
      },
      {
        "layerKind": "MORPHOLOGY",
        "annotationLayerId": "77777777-7777-4777-8777-777777777777"
      },
      {
        "layerKind": "CLAUSE_STRUCTURE",
        "annotationLayerId": "88888888-8888-4888-8888-888888888888"
      }
    ]
  },
  "nodes": [
    {
      "id": "V",
      "nodeType": "WORD",
      "bind": true
    },
    {
      "id": "P",
      "nodeType": "MORPHEME",
      "bind": true
    },
    {
      "id": "N",
      "nodeType": "WORD",
      "bind": true
    }
  ],
  "expression": {
    "operator": "ALL_OF",
    "children": [
      {
        "predicateType": "NODE_CONSTRAINT",
        "nodeId": "V",
        "field": "LEXEME",
        "operator": "EQ",
        "value": "ראה",
        "annotationLayerId": "77777777-7777-4777-8777-777777777777"
      },
      {
        "predicateType": "NODE_CONSTRAINT",
        "nodeId": "P",
        "field": "LEXEME",
        "operator": "EQ",
        "value": "ל",
        "annotationLayerId": "66666666-6666-4666-8666-666666666666"
      },
      {
        "predicateType": "NODE_CONSTRAINT",
        "nodeId": "N",
        "field": "SEMANTIC_SET_VERSION",
        "operator": "EQ",
        "value": "99999999-9999-4999-8999-999999999999"
      },
      {
        "predicateType": "RELATION",
        "relationType": "PREFIX_MORPHEME_OF",
        "from": "P",
        "to": "N",
        "annotationLayerId": "66666666-6666-4666-8666-666666666666"
      },
      {
        "predicateType": "RELATION",
        "relationType": "SAME_CLAUSE",
        "from": "V",
        "to": "N",
        "annotationLayerId": "88888888-8888-4888-8888-888888888888"
      }
    ]
  },
  "result": {
    "limit": 100,
    "groupBy": "CONSTRUCTION",
    "includeMatchExplanation": true
  }
}
